{
  "schema": "nogra.role.lease.v1",
  "leaseId": "role-lease-run-example-executor-20260723120000-abcdef",
  "workspaceId": "example-workspace",
  "runId": "run-example",
  "briefId": "brief-example",
  "briefHash": "sha256:0000000000000000000000000000000000000000000000000000000000000000",
  "role": "executor",
  "owner": "Manager",
  "status": "active",
  "agentId": null,
  "scopePatterns": [
    "src/example.js"
  ],
  "allowedTools": [
    "Read",
    "Edit",
    "MultiEdit",
    "Write",
    "Grep",
    "Glob"
  ],
  "createdAt": "2026-07-23T12:00:00.000Z",
  "updatedAt": "2026-07-23T12:00:00.000Z",
  "expiresAt": "2026-07-23T14:00:00.000Z",
  "closedAt": null,
  "closeReason": "",
  "ledgerWatermark": 1,
  "sessionId": "",
  "transcriptId": "",
  "metadata": {
    "source": "manager_role_enter",
    "strictPublicProfile": true
  }
}
